{
    "id": "CVE-1900-1234",
    "timestamp": "2021-09-29T15:29:44Z",
    "schemaVersion": "1-0-1",
    "selections": [
	{
	    "namespace": "ssvc",
	    "name": "Exploitation",
	    "version": "1.1.0",
	    "values": [
		"Active"
	    ]
	},
	{
	    "namespace": "ssvc",
	    "name": "Automatable",
	    "version": "2.0.0",
	    "values": [
		"Yes"
	    ]
	},
	{
	    "namespace": "ssvc",
	    "name": "Technical Impact",
	    "version": "1.0.0",
	    "values": [
		"Total"
	    ]
	}
    ]
}
